<!ELEMENT personal_info(id,name,address,mobile,dob,age,qualification)>
<!ELEMENT id (#PCDATA)>
<!ELEMENT name (#PCDATA)>
<!ELEMENT address (#PCDATA)>
<!ELEMENT mobile (#PCDATA)>
<!ELEMENT dob (#PCDATA)>
<!ELEMENT age (#PCDATA)>
<!ELEMENT qualification (#PCDATA)>
